[
  {
    "uid": "SRC-0001",
    "title": "Open Food Facts bulk database",
    "vendor": "Open Food Facts",
    "year": "current bulk",
    "source_type": "Open Data Bulk",
    "domain": "Food / Survival / Consumer Products",
    "sector": "Human / Consumer; Market / Exchange",
    "scope": "International; National",
    "status": "Current open-data source",
    "priority": "High",
    "sensitivity": "Normal",
    "conversion_mode": "Local processor; product identity and survival-value extracts",
    "recommended_path": "data-sources/open_food_facts/",
    "expected_tables": "food_product_identity; food_survival_value; food_brand_index; food_store_index; food_category_bricks",
    "notes": "Already locally processed in first Canada run; raw JSONL stays local."
  },
  {
    "uid": "SRC-0002",
    "title": "NAPCS Canada 2022 product classification",
    "vendor": "Statistics Canada",
    "year": "2022",
    "source_type": "Official Classification",
    "domain": "Product / Goods / Services Classification",
    "sector": "Market / Exchange; Business / Commercial; Public / Government",
    "scope": "National",
    "status": "Current official reference",
    "priority": "High",
    "sensitivity": "Normal",
    "conversion_mode": "Official taxonomy import; crosswalk layer",
    "recommended_path": "Comparator-definitions/taxonomy/canada/NAPCS_2022/",
    "expected_tables": "napcs_nodes; napcs_leaf_nodes; napcs_elements; comparator_crosswalk",
    "notes": "Use as official classification crosswalk, not as user-facing need tree replacement."
  },
  {
    "uid": "SRC-0003",
    "title": "ISED Financial Performance Data 2024",
    "vendor": "Innovation, Science and Economic Development Canada",
    "year": "2024",
    "source_type": "Official Business Financial Benchmark",
    "domain": "Small Business Calibration",
    "sector": "Business / Commercial; Finance / Capital",
    "scope": "National; Provincial",
    "status": "Current official benchmark",
    "priority": "High",
    "sensitivity": "Normal",
    "conversion_mode": "Normalized calibration profiles",
    "recommended_path": "data-sources/ised_fpd_2024/",
    "expected_tables": "business_type_calibration_profiles; financial_ratio_benchmarks; expense_benchmarks",
    "notes": "Already packaged as GitHub-safe v0.2; raw ZIP should stay as Release asset."
  },
  {
    "uid": "SRC-0004",
    "title": "Statistics Canada cube downloads",
    "vendor": "Statistics Canada",
    "year": "various; local copies dated 2021",
    "source_type": "Official Statistical Cubes",
    "domain": "Population / Labour / Education / CPI / Demographics",
    "sector": "Public / Government; Human / Consumer; Market / Exchange",
    "scope": "National; Provincial",
    "status": "Stale local copies; refreshable by PID",
    "priority": "High",
    "sensitivity": "Aggregate statistics only",
    "conversion_mode": "StatCan Cube Importer v0.1",
    "recommended_path": "data-sources/statcan_cubes/",
    "expected_tables": "source_inventory; zip_inventory; cube_metadata; dimensions; dimension_members; observations_parquet; comparator_mapping",
    "notes": "Initial sample import succeeded; latest-PID refresh is next."
  },
  {
    "uid": "SRC-0005",
    "title": "GS1 GPC Browser and barcode/product identity references",
    "vendor": "GS1 / GS1 Canada",
    "year": "current",
    "source_type": "Product Identity / Classification Reference",
    "domain": "Barcodes / GPC Bricks / Product Identity",
    "sector": "Market / Exchange; Business / Commercial",
    "scope": "International; National",
    "status": "Acquisition target",
    "priority": "High",
    "sensitivity": "Normal",
    "conversion_mode": "Crosswalk/product identity reference",
    "recommended_path": "data-sources/product_identity/gs1_gpc/",
    "expected_tables": "gpc_segments; gpc_families; gpc_classes; gpc_bricks; barcode_identity_crosswalk",
    "notes": "Use brick terminology for product-level datagrid refinement."
  },
  {
    "uid": "SRC-0006",
    "title": "NVD CPE",
    "vendor": "NIST / NVD",
    "year": "current",
    "source_type": "Open Technical Classification",
    "domain": "Computer / IT product identity",
    "sector": "Information / Records; Market / Exchange",
    "scope": "International",
    "status": "Acquisition target",
    "priority": "Medium",
    "sensitivity": "Normal",
    "conversion_mode": "CPE dictionary import",
    "recommended_path": "data-sources/it_products/nvd_cpe/",
    "expected_tables": "software_hardware_cpe; vendor_product_versions",
    "notes": "Useful for IT/software product identity, not retail SKU pricing."
  },
  {
    "uid": "SRC-0007",
    "title": "ENERGY STAR product datasets",
    "vendor": "ENERGY STAR",
    "year": "current",
    "source_type": "Open Product/Efficiency Dataset",
    "domain": "Appliances / HVAC / Energy",
    "sector": "Human / Consumer; Market / Exchange; Resources / Environment",
    "scope": "National; International",
    "status": "Acquisition target",
    "priority": "High",
    "sensitivity": "Normal",
    "conversion_mode": "Downloadable CSV/product dataset",
    "recommended_path": "data-sources/energy_appliances/energy_star/",
    "expected_tables": "certified_products; efficiency_specs; category_crosswalk",
    "notes": "High value for appliance and building-system comparison."
  },
  {
    "uid": "SRC-0008",
    "title": "NHTSA vehicle datasets",
    "vendor": "NHTSA",
    "year": "current",
    "source_type": "Open Vehicle Dataset",
    "domain": "Vehicles / Safety / VIN",
    "sector": "Human / Consumer; Public / Government; Market / Exchange",
    "scope": "National",
    "status": "Acquisition target",
    "priority": "High",
    "sensitivity": "Normal",
    "conversion_mode": "API/CSV vehicle reference",
    "recommended_path": "data-sources/transportation/nhtsa/",
    "expected_tables": "vehicle_make_model; safety_recalls; vin_decode_fields",
    "notes": "Use to refresh vehicle taxonomy and current safety info."
  },
  {
    "uid": "SRC-0100",
    "title": "Essentra Components Catalog Volume 14",
    "vendor": "Essentra Components / Alliance / Reid / Richco",
    "year": "2014",
    "source_type": "Industrial Component Catalog",
    "domain": "Industrial Components / Hardware / Fasteners / Motion / Electronics",
    "sector": "Business / Commercial; Market / Exchange",
    "scope": "Organizational",
    "status": "Historical catalog; current families likely online",
    "priority": "Very High",
    "sensitivity": "Normal",
    "conversion_mode": "PDF table extraction by section",
    "recommended_path": "data-sources/catalog_conversions/industrial_components/essentra_2014/",
    "expected_tables": "industrial_components; essentra_category_tree; component_spec_dictionary",
    "notes": "Over 1,000 pages; structured contents and repeated item/spec tables."
  },
  {
    "uid": "SRC-0101",
    "title": "Faucher complete truck-body hardware set",
    "vendor": "Faucher",
    "year": "2011-2014",
    "source_type": "Truck Body Hardware Catalog Set",
    "domain": "Truck Body / Camper / Emergency Vehicle Components",
    "sector": "Business / Commercial; Market / Exchange",
    "scope": "Organizational",
    "status": "Historical/current mixed; many items likely current equivalents",
    "priority": "Very High",
    "sensitivity": "Normal",
    "conversion_mode": "Small PDFs; direct table extraction",
    "recommended_path": "data-sources/catalog_conversions/truck_body_hardware/faucher/",
    "expected_tables": "truck_body_hardware_items; truck_body_hardware_category_tree; truck_body_spec_dictionary",
    "notes": "Handles, locks/latches, gas springs, hinges, adhesives, rubber, fasteners, cargo control, heaters, lights."
  },
  {
    "uid": "SRC-0102",
    "title": "Parker Hose, Fittings and Equipment Catalog 4400",
    "vendor": "Parker Hannifin",
    "year": "2015",
    "source_type": "Fluid Power / Hose Catalog",
    "domain": "Hydraulic Hose / Fittings / Safety / Crimping",
    "sector": "Business / Commercial; Market / Exchange",
    "scope": "Organizational",
    "status": "Historical catalog; technical reference",
    "priority": "Very High",
    "sensitivity": "Safety-critical technical selection",
    "conversion_mode": "Section extraction and safety-rule dictionary",
    "recommended_path": "data-sources/catalog_conversions/fluid_power/parker_hose_4400/",
    "expected_tables": "hose_products; hose_fittings; crimp_equipment; hose_selection_rules; safety_notes",
    "notes": "Keep safety warnings and do-not-mix rules attached to records."
  },
  {
    "uid": "SRC-0103",
    "title": "Gregg Distributors Product Catalogue",
    "vendor": "Gregg Distributors Ltd.",
    "year": "2016",
    "source_type": "Canadian Industrial Supply Catalog",
    "domain": "Industrial MRO / Tools / Fasteners / Safety / Automotive / Hose",
    "sector": "Business / Commercial; Human / Consumer; Market / Exchange",
    "scope": "Organizational; Provincial/State",
    "status": "Historical catalog; Canadian supplier reference",
    "priority": "Very High",
    "sensitivity": "Normal; safety sections flagged",
    "conversion_mode": "Large catalog; sectioned extraction queue",
    "recommended_path": "data-sources/catalog_conversions/canadian_industrial_supply/gregg_2016/",
    "expected_tables": "gregg_catalog_items; gregg_section_tree; supplier_branch_records; mro_category_index",
    "notes": "2,600+ pages; convert by section rather than whole catalog at once."
  },
  {
    "uid": "SRC-0104",
    "title": "80/20 Catalog 20",
    "vendor": "80/20 Inc.",
    "year": "circa 2014",
    "source_type": "Modular Framing System Catalog",
    "domain": "T-Slot Aluminum / Modular Framing / Machine Guards / Workstations",
    "sector": "Business / Commercial; Market / Exchange",
    "scope": "Organizational; Personal",
    "status": "Historical catalog; current online refresh possible",
    "priority": "Very High",
    "sensitivity": "Normal",